id,user,updated,source,text,tags,html_start_node,html_end_node,start_offset,end_offset,reply_to
"UXXJel33EemqN99df1dU1A","acct:frankensteinvariorum@hypothes.is","2019-04-13T14:20:41.604946+00:00","https://ebeshero.github.io/Pittsburgh_Frankenstein/Frankenstein_1818.html","The Aztec empire, located in Mexico, was conquered by the Spanish in 1521, and the Peruvian Inca empire was conquered in 1532.","Aztec;Americas","/p[129]","/p[129]",1104,1166,
"U_JQpl33EemPim_EUCSuYw","acct:frankensteinvariorum@hypothes.is","2019-04-13T14:20:45.596140+00:00","https://ebeshero.github.io/Pittsburgh_Frankenstein/Frankenstein_1818.html","REDO--include the whole list of genres from the Illiad to ""the most humble novelist). Then revise the next note to explain the ambition of the novel to embrace this literary pantheon.","Shakespeare;drama;romance","/p[2]","/p[2]",204,216,
"UivPVF33EemvzFv49xUwZQ","acct:frankensteinvariorum@hypothes.is","2019-04-13T14:20:42.818578+00:00","https://ebeshero.github.io/Pittsburgh_Frankenstein/Frankenstein_1818.html","Pinnacles of rock.","geography;mountains","/p[280]/i[1]","/p[280]/i[1]",0,9,
"UvV-gF33EemyTW-MnTAVYw","acct:frankensteinvariorum@hypothes.is","2019-04-13T14:20:44.043063+00:00","https://ebeshero.github.io/Pittsburgh_Frankenstein/Frankenstein_1831.html","In this 1831 amendment to the 1818 edition, Elizabeth changes from Victor's first cousin to his ""more than sister."" It is unclear exactly why Shelley decided to make the change, but critics have thought that the incestuous relationship between Victor and Elizabeth may have scandalized readers. It is true, however, that incest was of significant fascination to Shelley. Her novella *Mathilda*, published posthumously in 1954, concerns the relationship of a woman with her father. After sending the manuscript to William Godwin, he told Shelley he found the depiction of incest ""disgusting and detestable,"" and refused to return the manuscript to his daughter.

Shelley, Mary. *Matilda*; with Mary and Maria, by Mary Wollstonecraft. Ed. Janet Todd. London: Penguin, 1992, p. xvii. ","","/p[102]","/p[102]",776,795,
"V6gyLl33Eem2MUMwbf2xQQ","acct:frankensteinvariorum@hypothes.is","2019-04-13T14:20:52.009372+00:00","https://ebeshero.github.io/Pittsburgh_Frankenstein/Frankenstein_1818.html","The main peak of a group of hills in Edinburgh, Scotland. ","","/p[515]","/p[515]",394,407,
"VMYDOF33EemYIg8G3nfhVA","acct:frankensteinvariorum@hypothes.is","2019-04-13T14:20:47.177782+00:00","https://ebeshero.github.io/Pittsburgh_Frankenstein/Frankenstein_1818.html","St Andrews is a town on the east coast of Fife in Scotland,  30 miles northeast of Edinburgh. It is home to the University of St Andrews, the third oldest university in the English-speaking world. ","","/p[516]","/p[516]",53,64,
"VXtk7l33EemrsIdyC37iSA","acct:frankensteinvariorum@hypothes.is","2019-04-13T14:20:48.368068+00:00","https://ebeshero.github.io/Pittsburgh_Frankenstein/Frankenstein_1818.html","Walton's decision to end his journey","","/p[736]","/p[736]",0,69,
"VjLoHF33EemVCZ8M6bts3g","acct:frankensteinvariorum@hypothes.is","2019-04-13T14:20:49.571875+00:00","https://ebeshero.github.io/Pittsburgh_Frankenstein/Frankenstein_1818.html","Victor followed the Rhone as it winded its way south, toward the Mediterranean. ","expedition;Rhone;geography;Mediterranean","/p[693]","/p[693]",82,137,
"Vuornl33EemN26_Y5yWq7w","acct:frankensteinvariorum@hypothes.is","2019-04-13T14:20:50.763083+00:00","https://ebeshero.github.io/Pittsburgh_Frankenstein/Frankenstein_1818.html","Though the microscope was likely developed in Holland, Robert Hooke's intricate *Micrographia* (1665), which showed close-up, detailed drawings of insects, was still widely read in Shelley's time.","Modern Science;Science;biology","/p[113]","/p[113]",366,376,
"W7kR2l33EemyTos1aJ2z4g","acct:frankensteinvariorum@hypothes.is","2019-04-13T14:20:58.829215+00:00","https://ebeshero.github.io/Pittsburgh_Frankenstein/Frankenstein_1818.html","Seneca the Younger (c. 4 BC – AD 65), who was simply known as Seneca, is a Roman Stoic philosopher and dramatist. His writings include one hundred and twenty-four letters that deal directly with moral issues. He was also forced to commit suicide, after becoming entangled in a plot to assassinate the Roman Emperor Nero.","Rome;morality;ethics;Seneca;suicide","/p[723]","/p[723]",605,612,
"WHsNFl33EemIknsGCUW3gA","acct:frankensteinvariorum@hypothes.is","2019-06-04T13:21:01.499484+00:00","https://ebeshero.github.io/Pittsburgh_Frankenstein/Frankenstein_1831.html","The springing of the leak in the 1831 edition replaces the breaking of the ship's mast in the 1818 edition. ","","/p[50]","/p[50]",123,146,
"WU1v_l33Eem2MqfoQ0FsXw","acct:frankensteinvariorum@hypothes.is","2019-04-13T14:20:54.757843+00:00","https://ebeshero.github.io/Pittsburgh_Frankenstein/Frankenstein_1818.html","A city lying on the banks of the River Derwent, Derbyshire.","","/p[512]","/p[512]",5,10,
"WjGXYF33EembdJOd5T2opA","acct:frankensteinvariorum@hypothes.is","2019-04-13T14:20:56.111278+00:00","https://ebeshero.github.io/Pittsburgh_Frankenstein/Frankenstein_1818.html","Percy Shelley had used the pseudonym Victor in previous work. This is the first mention of the narrator's first name.","Percy Shelley;Victor","/p[86]","/p[86]",1064,1078,
"Wv_3kF33Eemjtwf9FvcaHQ","acct:frankensteinvariorum@hypothes.is","2019-04-13T14:20:57.612380+00:00","https://ebeshero.github.io/Pittsburgh_Frankenstein/Frankenstein_1818.html","identify","Seneca;natural philosophy","/p[723]","/p[723]",613,613,
"X2eZgl33EemjuBtJ8AtJPg","acct:frankensteinvariorum@hypothes.is","2019-04-13T14:21:04.906446+00:00","https://ebeshero.github.io/Pittsburgh_Frankenstein/Frankenstein_1818.html","Victor recognizes the problems that have resulted in unreflective scientific inquiry, but only in hindsight, and appears to blame natural science rather than himself for his misfortunes.","science;guilt;hindsight","/p[174]","/p[174]",329,420,
"XHeFrF33EemVClt1jN_yYg","acct:frankensteinvariorum@hypothes.is","2019-04-13T14:21:00.035136+00:00","https://ebeshero.github.io/Pittsburgh_Frankenstein/Frankenstein_1818.html","A two-wheeled carriage","","/p[105]","/p[105]",24,30,
"XS4rSl33EemhIuNHj3AVWQ","acct:frankensteinvariorum@hypothes.is","2019-04-13T14:21:01.289916+00:00","https://ebeshero.github.io/Pittsburgh_Frankenstein/Frankenstein_1831.html","Shelley added this clarifying passage to the 1831 edition. By rephrasing “glory” as “advancement in his profession,” Shelley adopts a new expression, not usually found before 1810, indicating a more precise path to famed achievement. It was often used to mean advancement in Her Majesty’s Navy, thus it is especially apt for the lieutenant of Walton’s ship.","","/p[40]","/p[40]",387,491,
"XeMkAF33Eem2M2_Ok2FraA","acct:frankensteinvariorum@hypothes.is","2019-04-13T14:21:02.471652+00:00","https://ebeshero.github.io/Pittsburgh_Frankenstein/Frankenstein_1818.html","A county town in Derbyshire, just to the north of Matlock Bath, a former spa town.","","/p[506]","/p[506]",320,327,
"Xp35sF33EemFyqdhDyLfLQ","acct:frankensteinvariorum@hypothes.is","2019-04-13T14:21:03.695825+00:00","https://ebeshero.github.io/Pittsburgh_Frankenstein/Frankenstein_1818.html","Best remembered for the tale ""St. George and the Dragon"", a legend told by Crusaders, George became the patron saint of England.","dragon;monsters;Crusade","/p[82]","/p[82]",710,720,
"Y1BiuF33EemrsXtO9L01jQ","acct:frankensteinvariorum@hypothes.is","2019-04-13T14:21:11.445503+00:00","https://ebeshero.github.io/Pittsburgh_Frankenstein/Frankenstein_1818.html","Walton's imagined ""paradise"" of his own making suggests the power of imagination, yet also the possibility of creating a Hell of one's own as well (Victor).","paradise;religion;Milton;imagination;Hell;poetry","/p[10]","/p[10]",191,220,
"YC1VeF33Eem2NMN52955aQ","acct:frankensteinvariorum@hypothes.is","2019-04-13T14:21:06.315529+00:00","https://ebeshero.github.io/Pittsburgh_Frankenstein/Frankenstein_1818.html","Cato the Younger (95-46 BCE) was a Roman statesman and Stoic.","Ancient philosophy;Stoicism","/p[202]","/p[202]",792,796,
"YOsYal33EemvzV9Siutu_g","acct:frankensteinvariorum@hypothes.is","2019-04-13T14:21:07.500245+00:00","https://ebeshero.github.io/Pittsburgh_Frankenstein/Frankenstein_1818.html","An ironic connection between Victor and the Creature. Here  it is Victor, composed of materials, the shocks suspending him in the torturous realm between life and death.","","/p[574]","/p[573]",382,0,
"Ybh-fF33EemxR5Mo3Ti9SQ","acct:frankensteinvariorum@hypothes.is","2019-05-04T10:49:47.399345+00:00","https://ebeshero.github.io/Pittsburgh_Frankenstein/Frankenstein_1818.html","Cadavers for anatomical training in this period were scarce, and thus a medical education meant to study and extend life also fostered serial killers who committed murders for the sake of selling fresh corpses. Such killing sprees were ended by the Anatomical Act of 1832 in England, which made corpses legally available for medical research. ","science;physiology;anatomy","/p[124]","/p[124]",1756,1843,
"Yntc7l33EemW2S8MWb8NwA","acct:frankensteinvariorum@hypothes.is","2019-04-13T14:21:10.119156+00:00","https://ebeshero.github.io/Pittsburgh_Frankenstein/Frankenstein_1818.html","La Valais is an extremely mountainous region that includes the highest mountains in Switzerland. The highest mountain ranges are the Pennine Alps, the Bernese Alps and the Mont Blanc. The Pays de Vaud, on the other hand, is partly mountainous, though visually arresting, having summits of about 3,000 meters.","mountains;geography;Mont Blanc","/p[495]","/p[495]",1458,1518,
"Z64jIl33Eem_ASfiWCYaXg","acct:frankensteinvariorum@hypothes.is","2019-04-13T14:21:18.888429+00:00","https://ebeshero.github.io/Pittsburgh_Frankenstein/Frankenstein_1818.html","Romulus (c. 750 BC) founded the city of Rome, its institutions, government, military and religious traditions. He reigned for many years as its first king. He is thought to have killed his twin brother, Remus.","Romulus;Remus;Rome;politics;family","/p[384]","/p[384]",1378,1385,
"ZBeLNl33EemDdAPlsee3LA","acct:frankensteinvariorum@hypothes.is","2019-04-13T14:21:12.871874+00:00","https://ebeshero.github.io/Pittsburgh_Frankenstein/Frankenstein_1818.html","The ""genius that relegates his fate"" is Victor's search for glory and fame through modern natural philosophy, what we now call experimental science. Creating immortality would certainly be the kind of thing that could bring him the renown he seeks.","science;immortality;alchemy;glory;fate","/p[89]","/p[89]",518,564,
"ZM0iZl33EemFy_PKko-oHg","acct:frankensteinvariorum@hypothes.is","2019-04-13T14:21:14.063047+00:00","https://ebeshero.github.io/Pittsburgh_Frankenstein/Frankenstein_1818.html","WHY this publisher and printer? look for details in Shelleys biographies or articles
JON search","book history","/span[9]/i[1]","/span[4]/i[1]",0,48,
"ZYC_2F33EemIk_vaC-zUvQ","acct:frankensteinvariorum@hypothes.is","2019-04-13T14:21:15.239866+00:00","https://ebeshero.github.io/Pittsburgh_Frankenstein/Frankenstein_1818.html","Born in Geneva Switzerland, Victor is a potential hero insofar as he embodies the ""republican"" virtue's of Europe's only country, much admired by the Shelleys, which did not have a hereditary monarchy. By making Geneva so central to the novel's cultural geography, Mary Shelley also designates the relation between Victor's ambition and Jean Jacques Rousseau's world-making ambition in *Discourse on Inequality* among other works.","Switzerland;political philosophy;geography","/p[72]","/p[72]",1,25,
"ZjXUuF33EemhI_fzzmDFwA","acct:frankensteinvariorum@hypothes.is","2019-04-13T14:21:16.424720+00:00","https://ebeshero.github.io/Pittsburgh_Frankenstein/Frankenstein_1818.html","explain his social standing","","/p[360]","/p[360]",39,85,
"ZvM2jl33EemZLrssUP6oOA","acct:frankensteinvariorum@hypothes.is","2019-04-13T14:21:17.646033+00:00","https://ebeshero.github.io/Pittsburgh_Frankenstein/Frankenstein_1818.html","Rising in the northern side of the Mont Blanc in the Alps, the river Arve receives water from the many glaciers of the Chamounix valley. The river is known for its frigid waters.","Mont Blanc;Arve;geography;Chamounix","/p[282]","/p[282]",129,229,
"_6dP-l33Eemubt-UL-9-TQ","acct:frankensteinvariorum@hypothes.is","2019-05-04T10:50:51.086241+00:00","https://ebeshero.github.io/Pittsburgh_Frankenstein/Frankenstein_1818.html","Victor implies that life can be renewed from death, a theme present in biblical scripture (Genesis 3:19, 18:27; Job 30:19; Ecclesiastes 3:20) as well as the Anglican Book of Common Prayer (Burial Rite 1:485, 2:501)","The Bible;Victor;Book of Common Prayer;Genesis","/p[125]","/p[125]",717,727,
"_Javml33EemDea-p7gx93w","acct:frankensteinvariorum@hypothes.is","2019-04-13T14:25:28.704916+00:00","https://ebeshero.github.io/Pittsburgh_Frankenstein/Frankenstein_1818.html","Victor's admiration for John Hampden (1595-1643)--a leading English dissident opposing Charles I in the early years of the English Revolution--sits uneasily with his earlier nostalgia for the days of Charles I. Where the Creature had shown a consistent and clear sympathy with the radical Enlightenment, Victor seems as confused about the reactionary and progressive elements of the English past as he had about the modern and premodern versions of ""natural philosophy"" in the history of science. See also Iain Crawford, ""Wading Through Slaughter: John Hampden, Thomas Gray, and Mary Shelley's *Frankenstein*,"" *Studies in the Novel,* 20.3 (1988): 249-61.","","/p[509]","/p[509]",350,382,
"_U58JF33Eem_rrcR2eoqrA","acct:frankensteinvariorum@hypothes.is","2019-04-13T14:25:29.931135+00:00","https://ebeshero.github.io/Pittsburgh_Frankenstein/Frankenstein_1818.html","""Guided by a slight clue,"" Victor tracks the monster from Geneva along the windings of the Rhone southward to the Mediterranean. He spots the monster hiding on a ship and follows him to the Black Sea, through the wilds of Tartary and Russia. Ultimately, he travels northward, into the ice.","expedition;Black Sea;Tartary;Russia;Geneva;ice","/p[687]","/p[687]",0,27,
"_gncgF33EemyVrs30TA_OA","acct:frankensteinvariorum@hypothes.is","2019-04-13T14:25:31.138058+00:00","https://ebeshero.github.io/Pittsburgh_Frankenstein/Frankenstein_1818.html","Mary may be borrowing from her father's work. Compare with William Godwin's *Political Justice*: ""Refer them to reading, to conversation ... but teach them neither creeds nor catechisms , either moral or political ... Speak the language of truth and reason to your child, and be under no apprehension for the result. Show him that what you recommend is valuable and desirable, and fear not but he will desire it. Convince his understanding, and you enlist all his powers animal and intellectual in your service.""","William Godwin;politics;law;education","/p[83]","/p[83]",0,297,
"_scGel33Eemcr6fB-1TNXw","acct:frankensteinvariorum@hypothes.is","2019-04-13T14:25:32.378671+00:00","https://ebeshero.github.io/Pittsburgh_Frankenstein/Frankenstein_1818.html","Victor quotes Leigh Hunt's poem ""The Story of Rimini,"" published in 1816--a poem Victor could not, of course, have known in the novel's fictional time frame that ends in summer 1799. Like the passage from Percy Shelley's ""Mutability,"" this line from Hunt's poem belongs to the novel's extra-diagetic address to readers of 1818 rather than to canons of novelistic realism. Clerval is once again made an avatar of the Romantic poet that by 1818 had become solidly esconced in the British cultural imaginary.



","Leigh Hunt;poetry;Romanticism","/p[495]","/p[495]",182,218,
"a1-dDF33EemjuZe4c46qdg","acct:frankensteinvariorum@hypothes.is","2019-04-13T14:21:25.040106+00:00","https://ebeshero.github.io/Pittsburgh_Frankenstein/Frankenstein_1818.html","The Jura Mountains are a sub-alpine mountain range to the north of the Western Alps, along the border of Switzerland and France.","","/p[93]","/p[93]",207,211,
"aGPABl33Eem_0tefCyBLcA","acct:frankensteinvariorum@hypothes.is","2019-04-13T14:21:20.085071+00:00","https://ebeshero.github.io/Pittsburgh_Frankenstein/Frankenstein_1818.html","The Creature's awakening to consciousness alludes to accounts of consciousness and maturation by John Locke and Jean-Jacques Rousseau.

Locke gives an account of how the mind of a child slowly learns to distinguish the various senses before it can apprehend the world *in totu*, in Ch. 7 of his *An Essay Concerning Human Understanding*.

Rousseau's *Emile*, which Mary records having read in 1815, also offers an account contrasting the senses of an adult to the senses of a child.","John Locke;Jean-Jaques Rousseau;Emile;children;pyschology","/p[299]","/p[299]",286,398,
"aRhLtl33EemvzsNPDO2d7w","acct:frankensteinvariorum@hypothes.is","2019-04-13T14:21:21.277247+00:00","https://ebeshero.github.io/Pittsburgh_Frankenstein/Frankenstein_1818.html","The philosophers stone was also called the elixir of life, or thought to create it, and useful for rejuvenation and for achieving immortality; for many centuries, the stone and the elixir were the most sought goal in alchemy.","alchemy;magic;science","/p[89]","/p[89]",411,425,
"adEaBl33EemW2s9CJ4LLog","acct:frankensteinvariorum@hypothes.is","2019-04-13T14:21:22.463740+00:00","https://ebeshero.github.io/Pittsburgh_Frankenstein/Frankenstein_1818.html","In the piece ""On Frankenstein,"" written by Percy Shelley and published in *The Athenaeum* in 1831, Percy describes ""The scene between the Being and the blind De Lacey in the cottage is one of the most profound and extraordinary instances of pathos that we ever recollect. It is impossible to read this dialogue--and indeed many other situations of a somewhat similar character--without feeling the heart suspend its pulsations with wonder, and the tears stream down the cheeks!""","","/p[396]","/p[396]",0,24,
"apjl9F33EemVCxulo6-OXg","acct:frankensteinvariorum@hypothes.is","2019-04-13T14:21:23.717545+00:00","https://ebeshero.github.io/Pittsburgh_Frankenstein/Frankenstein_1818.html","These German ghost stories were translated into French for the book Mary, Percy, and Byron read during the summer; its French title was *Fantasmagoria; ou Recueil d'Histoires, d'Apparitions, de Spectres, Revenans, Fantomes, etc.*, translated by Jean-Baptiste Benoit Eyries in 1812. ","ghost stories;scene of creation;gothic","/p[4]","/p[4]",435,478,
"b85Opl33Eem_qG-VxXn_Rw","acct:frankensteinvariorum@hypothes.is","2019-04-13T14:21:32.539574+00:00","https://ebeshero.github.io/Pittsburgh_Frankenstein/Frankenstein_1818.html","A tincture of opium, laudanum was popular among some English writers of the Romantice period including, most notably, Thomas de Quincey, whose *Confessions of an English Opium Eater* specifically related his experiences with and addiction to the drug.","","/p[611]","/p[611]",123,131,
"bCY2Ql33Eemf-rub9ItVfQ","acct:frankensteinvariorum@hypothes.is","2019-04-13T14:21:26.390632+00:00","https://ebeshero.github.io/Pittsburgh_Frankenstein/Frankenstein_1818.html","When Mary wrote *Frankenstein* slavery was still pervasive in Europe and the Americas, and slavery persisted in England until the 1834 Slavery Abolition Act. Mary's father, William Godwin, wrote against slavery in *An Enquiry Concerning Political Justice* (1793).","","/p[366]","/p[366]",54,99,
"bOQqxl33EemW2_d4vdh8zA","acct:frankensteinvariorum@hypothes.is","2019-04-13T14:21:27.605997+00:00","https://ebeshero.github.io/Pittsburgh_Frankenstein/Frankenstein_1831.html","TITLE omitted in 1831 edition: ""Frankenstein; or, The Modern Prometheus.""","","/h3[21]","/h3[21]",0,10,
"bZqFFF33EemqOEdXJsLpuQ","acct:frankensteinvariorum@hypothes.is","2019-04-13T14:21:28.838905+00:00","https://ebeshero.github.io/Pittsburgh_Frankenstein/Frankenstein_1818.html","Numa Pompilius (753–673 BC; reigned 715–673 BC) was the legendary second king of Rome, succeeding Romulus.","Rome;politics;Romulus","/p[384]","/p[384]",1334,1338,
"bkzk_F33EemrBadu0DhP8g","acct:frankensteinvariorum@hypothes.is","2019-04-13T14:21:30.011231+00:00","https://ebeshero.github.io/Pittsburgh_Frankenstein/Frankenstein_1818.html","Victor seems to regard himself as godlike in his research. Subsequently, he advances a personal ethics of creation in relation to the specific ""raw"" material he uses for his experiments, and to the source of the ""raw"" material.","science;ethics","/p[120]","/p[120]",2460,2664,
"bwXYzF33EemVDPMqBKhFBg","acct:frankensteinvariorum@hypothes.is","2019-04-13T14:21:31.200132+00:00","https://ebeshero.github.io/Pittsburgh_Frankenstein/Frankenstein_1818.html","The main land of Great Britain.","","/p[519]","/p[519]",654,663,
"c3gq6l33EemhJE-U28pL8A","acct:frankensteinvariorum@hypothes.is","2019-04-13T14:21:38.680890+00:00","https://ebeshero.github.io/Pittsburgh_Frankenstein/Frankenstein_1818.html","The Creature's desire to immolate himself is an unintentional yet eerie foreshadowing of Louis Edward Fournier's *The Funeral of Percy Shelley* (1889).","","/p[761]","/p[761]",483,566,
"cIP6lF33Eem_qfdiJcpYRg","acct:frankensteinvariorum@hypothes.is","2019-04-13T14:21:33.725558+00:00","https://ebeshero.github.io/Pittsburgh_Frankenstein/Frankenstein_1818.html","Lucius Cary, 2nd Viscount of Falkland (c. 1610-1643), fought on the Royalist side during the Civil War and was killed in action at the First Battle of Newbury. ","","/p[508]","/p[508]",519,528,
"cTizvF33EemimTvTTZkT_w","acct:frankensteinvariorum@hypothes.is","2019-04-13T14:21:34.905975+00:00","https://ebeshero.github.io/Pittsburgh_Frankenstein/Frankenstein_1818.html","The idea of ""domestic affection"" will be the most important virtue for Mary Shelley, one that is repeatedly violated by Victor Frankenstein's disregard of family responsibility, including the care of his own creation, the Creature.","domestic affection;family","/p[3]","/p[3]",682,700,
"cfFCiF33Eem1T-uePvdFlg","acct:frankensteinvariorum@hypothes.is","2019-04-13T14:21:36.108405+00:00","https://ebeshero.github.io/Pittsburgh_Frankenstein/Frankenstein_1831.html","Known for the number and length of its bridges, Lucerne was placed in German-speaking Switzerland. It had a population of about 100,000 in the late 1700s and it was notably scenic.","Lucerne","/p[94]","/p[94]",643,650,
"crVVpl33Eemf-xdsjSgyWQ","acct:frankensteinvariorum@hypothes.is","2019-04-13T14:21:37.370839+00:00","https://ebeshero.github.io/Pittsburgh_Frankenstein/Frankenstein_1818.html","The Salève is a mountain of the French Prealps. It is also called the ""Balcony of Geneva."" ","mountains;geography","/p[649]","/p[649]",299,423,
"d4eKIl33EemuZw-9sJoahg","acct:frankensteinvariorum@hypothes.is","2019-06-04T13:33:04.457996+00:00","https://ebeshero.github.io/Pittsburgh_Frankenstein/Frankenstein_1831.html","In this 1831 addition, Shelley emphasizes the effect Victor has on Walton and stresses Victor's weakened state.","","/p[92]","/p[92]",645,1078,
"dDEtJF33Eemg6AcYiaHbqQ","acct:frankensteinvariorum@hypothes.is","2019-04-13T14:21:39.851741+00:00","https://ebeshero.github.io/Pittsburgh_Frankenstein/Frankenstein_1818.html","Walton's concern becomes primarily about securing his reputation for posterity--literary or otherwise--rather than a pursuit of knowledge or its potential to advance society.","","/p[11]","/p[10]",464,0,
"dPuqDl33Eemf_BNcF9jtcA","acct:frankensteinvariorum@hypothes.is","2019-04-13T14:21:41.224030+00:00","https://ebeshero.github.io/Pittsburgh_Frankenstein/Frankenstein_1818.html","Strasburgh, or more commonly Strasbourg, is the capital of the Grand Est region of France, the official seat of the European Parliament. It is located close to the border with Germany in the historic region of Alsace. In Shelley's day, Strasburgh was a well known centre of humanism, at the crossroads of French and German intellectual traditions.","geography;humanism;French;German","/p[493]","/p[493]",93,126,
"ddO2iF33Eem_Am-AfenMFw","acct:frankensteinvariorum@hypothes.is","2019-04-13T14:21:42.626178+00:00","https://ebeshero.github.io/Pittsburgh_Frankenstein/Frankenstein_1818.html","The mayor or head of administration of a commune or canton. In Geneva, syndics were part of a council appointed by the legislature to govern the republic.","politics;Geneva","/p[72]","/p[72]",163,170,
"drU_hl33EemhJbs9W_mZLw","acct:frankensteinvariorum@hypothes.is","2019-04-13T14:21:44.080009+00:00","https://ebeshero.github.io/Pittsburgh_Frankenstein/Frankenstein_1818.html","This allusion to Milton's *Paradise Lost* puzzles some readers because the epigram of Volume II has previously quoted Adam's entreaty to God. Is the Creature more like Adam or more like the fallen angel Satan?","John Milton;poetry","/p[292]","/p[292]",819,904,
"eFf9Ql33EemxRc-WtxYfzg","acct:frankensteinvariorum@hypothes.is","2019-04-13T14:21:46.844062+00:00","https://ebeshero.github.io/Pittsburgh_Frankenstein/Frankenstein_1818.html","There were a number of different denominations of Orthodox Christianity prevailing in Turkey at the time, which was predominantly Muslim under the Ottoman Empire.","","/p[366]","/p[366]",38,53,
"eRCF9l33EemPixts07WjHw","acct:frankensteinvariorum@hypothes.is","2019-06-04T13:34:02.043707+00:00","https://ebeshero.github.io/Pittsburgh_Frankenstein/Frankenstein_1831.html","Geneva is the principle French-speaking city of Switzerland.
DONE IN 1818?","","/p[93]","/p[93]",17,25,
"e_mqVF33EemEWMuxHmXK4g","acct:frankensteinvariorum@hypothes.is","2019-04-13T14:21:52.912148+00:00","https://ebeshero.github.io/Pittsburgh_Frankenstein/Frankenstein_1818.html","Victor expresses guilt over his failure to make the existence of the creature known to the public, especially at the trial of Justine. In Volume 3, Chapter 5, Victor claims that it is well for ""the unfortunate to be resigned,"" since ""for the guilty there is no peace.""","guilt;Justine;family","/p[268]","/p[268]",508,569,
