id,user,updated,source,text,tags,html_start_node,html_end_node,start_offset,end_offset,reply_to
"ect46F33EemEV_Ok7CxFUA","acct:frankensteinvariorum@hypothes.is","2019-04-13T14:21:49.275857+00:00","https://ebeshero.github.io/Pittsburgh_Frankenstein/Frankenstein_1818.html","Along with the reference to Coleridge's ""Rime of the Ancient Manner"", Victor's hopeless plight reminds us somewhat of William Cowper's (1731-1800) ""The Castaway"" (1799). Victor, however, does not perish ""each alone"", but rather in the company of his new friend Walton. The Creature, by contrast, chooses to perish alone.","","/p[42]","/p[42]",670,751,
"eoQRgl33Eemcq4NIZ06eeA","acct:frankensteinvariorum@hypothes.is","2019-04-13T14:21:50.505992+00:00","https://ebeshero.github.io/Pittsburgh_Frankenstein/Frankenstein_1818.html","The longest river in Scotland, originating on the slopes of Ben Lui in the west of the country. ","","/p[516]","/p[516]",102,105,
"ez8zBF33Eem_A7eAPXNrMw","acct:frankensteinvariorum@hypothes.is","2019-04-13T14:21:51.710810+00:00","https://ebeshero.github.io/Pittsburgh_Frankenstein/Frankenstein_1818.html","Klinger notes the ambiguity of where it is Victor supposedly acquires these parts. Could it be that Victor visits the Charnel Houses of Perth for his gruesome acquisitions? (Klinger 203n3).","","/p[504]","/p[504]",879,885,
"f3o6woJVEemFvs93FQc-hQ","acct:frankensteinvariorum@hypothes.is","2019-05-29T21:05:33.350932+00:00","https://ebeshero.github.io/Pittsburgh_Frankenstein/Frankenstein_1818.html","Situated near the peaks of the Aiguilles Rouges, Chamounix faces the north side of the summit of Mont Blanc. Picturesque, Chamounix was the host of the first Winter Olympics in 1924.","","/p[277]","/p[277]",665,674,
"f6WM6l33EemyUEfUhENrDg","acct:frankensteinvariorum@hypothes.is","2019-04-13T14:21:59.116931+00:00","https://ebeshero.github.io/Pittsburgh_Frankenstein/Frankenstein_1831.html","A reference to the holy wars of the Crusades, which dominated the first half of the second millennium after Christ. The ""chivalrous train"" refers to the Christian knights of Europe who sought to regain control over the Holy Lands of the Levant. ","","/p[105]","/p[105]",1265,1384,
"fL72dF33Eem2Nlsr93ryEA","acct:frankensteinvariorum@hypothes.is","2019-04-13T14:21:54.248356+00:00","https://ebeshero.github.io/Pittsburgh_Frankenstein/Frankenstein_1818.html","Mary suggests that one possible reaction to rejection and exclusion is outrage. ","rejection","/p[335]","/p[335]",467,527,
"fXpd4l33EembdT-t-aNNMg","acct:frankensteinvariorum@hypothes.is","2019-04-13T14:21:55.421328+00:00","https://ebeshero.github.io/Pittsburgh_Frankenstein/Frankenstein_1818.html","Victor, the son of a syndic, knows all too well that a legal deposition is able to make sensible his horrifying tale.","","/p[675]","/p[675]",270,378,
"fjda8F33EemEWVuH3Hw9jQ","acct:frankensteinvariorum@hypothes.is","2019-04-13T14:21:56.702846+00:00","https://ebeshero.github.io/Pittsburgh_Frankenstein/Frankenstein_1818.html","Rather than entertain the negative consequences of his creation, Victor imagines creating a race of that will worship him.","fame;property;religion;God;slavery;Victor","/p[125]","/p[125]",447,493,
"fvFRsl33EemyTwOp5OnH0A","acct:frankensteinvariorum@hypothes.is","2019-04-13T14:21:57.919431+00:00","https://ebeshero.github.io/Pittsburgh_Frankenstein/Frankenstein_1831.html","Appears as ""at one time"" in the 1818 edition.","","/p[89]","/p[89]",334,347,
"g0gifF33Eem_04c623Q6gA","acct:frankensteinvariorum@hypothes.is","2019-04-13T14:22:05.212427+00:00","https://ebeshero.github.io/Pittsburgh_Frankenstein/Frankenstein_1818.html","A type of public carriage.","Transport","/p[140]","/p[140]",67,85,
"gFrzll33EemuaN8VA8_qOA","acct:frankensteinvariorum@hypothes.is","2019-06-04T13:43:33.837387+00:00","https://ebeshero.github.io/Pittsburgh_Frankenstein/Frankenstein_1831.html","This substantial revision in 1831 seems to place greater blame on Beaufort for his condition as a matter of ""false pride"" (a sin). in the 1818 version, his primary concern is for society's loss of Beaufort, while in the 1831, his primary concern is for Beaufort's betrayal of the affection that once united them.","","/p[94]","/p[94]",849,1167,
"gRBU6F33EemN3auc4RMMVA","acct:frankensteinvariorum@hypothes.is","2019-04-13T14:22:01.472395+00:00","https://ebeshero.github.io/Pittsburgh_Frankenstein/Frankenstein_1818.html","The patron saint of natural scientists, Albertus Magnus (1193-1280) was the teacher of St. Thomas Aquinas. Although interested in alchemy and astrology, he is often praised for his rejection of dogmatic philosophy and for his stress on experimentation. Many books, including the *Little Book on Alchemy*, were falsely attributed to Magnus but likely written by Paracelsus.","natural philosophy;science;Albertus Magnus;alchemy","/p[89]","/p[89]",47,62,
"g_0ZIF33EemVDfO2-8CtWw","acct:frankensteinvariorum@hypothes.is","2019-04-13T14:22:06.389472+00:00","https://ebeshero.github.io/Pittsburgh_Frankenstein/Frankenstein_1818.html","The Creature clearly identifies himself with the hero of Goethe's novel *The Sorrows of Werther* (1774) but unlike many of its European readers, Werther is not a glamorous figure but an emblem of the Creature's own isolation and despair. On the relation of these novels, see also Roswitha Burwick, ""Goethe's *Werther* and Mary Shelley's *Frankenstein*,"" *Wordsworth Circle* 24.1 (1993): 47-52.","Goethe;Sorrows of Werther","/p[381]/i[1]","/p[381]",248,17,
"gcZfNl33EemxSIfNIRBgPg","acct:frankensteinvariorum@hypothes.is","2019-04-13T14:22:02.659627+00:00","https://ebeshero.github.io/Pittsburgh_Frankenstein/Frankenstein_1818.html","The novel’s subtitle invokes the trickster hero of Greek mythology, Prometheus, who defies the Gods by stealing fire (a symbol of knowledge) and giving it to humanity. Akin to Victor Frankenstein, Prometheus is also credited with the creation of man, which he fashions out of clay. As punishment for the disobedience, Zeus condemns Prometheus to eternal torment: he is chained to a rock for eternity while an eagle feeds on his liver. Shelley’s husband Percy would later take up the Prometheus myth in the closet drama *Prometheus Unbound*, published in 1819. Reading the novel against the myth, we can understand Prometheus’s punishment for the Gods akin to Victor’s psychological torment for defying nature.","","/h3[1]","/h3[1]",18,39,
"gooSPF33EemW3JvLn94kOA","acct:frankensteinvariorum@hypothes.is","2019-04-13T14:22:03.893087+00:00","https://ebeshero.github.io/Pittsburgh_Frankenstein/Frankenstein_1818.html","Refers to the Cape of Good Hope and Cape Horn, respectively.","","/p[25]","/p[25]",104,130,
"h5XUtF33EemrssOMi6H1tQ","acct:frankensteinvariorum@hypothes.is","2019-04-13T14:22:12.430134+00:00","https://ebeshero.github.io/Pittsburgh_Frankenstein/Frankenstein_1818.html","A clue that the Creature learns French, since Victor's native tongue must have been French.","language;French;education","/p[386]","/p[386]",264,346,
"hLOCgl33EemhJhscetc-nw","acct:frankensteinvariorum@hypothes.is","2019-04-13T14:22:07.590386+00:00","https://ebeshero.github.io/Pittsburgh_Frankenstein/Frankenstein_1818.html","With Victor's mother's death, her wish for Elizabeth begins a series of symbolic family roles she will occupy: mother to the children, ""sister"" to Victor, and eventually ""wife"" to Victor.","mother;family;domestic affections","/p[100]","/p[100]",1628,1714,
"hWpGAl33EemPjNsExyKtxQ","acct:frankensteinvariorum@hypothes.is","2019-04-13T14:22:08.776743+00:00","https://ebeshero.github.io/Pittsburgh_Frankenstein/Frankenstein_1818.html","Pandaemonium (""All demons"" in Latin), was the capital of Hell in Milton's *Paradise Lost* (II.119-69).","John Milton;Paradise Lost;Latin","/p[307]","/p[307]",951,962,
"hidX4l33EemyC4PuyP1fhg","acct:frankensteinvariorum@hypothes.is","2019-04-13T14:22:10.031646+00:00","https://ebeshero.github.io/Pittsburgh_Frankenstein/Frankenstein_1818.html","Gravesend is an ancient town in northwest Kent, England. Woolwich was also originally a town in Kent. Greenwich is an area of south east London, England, near Charing Cross.","England;geography","/p[500]","/p[500]",527,620,
"huLPcl33EemIlAsY8fY8PQ","acct:frankensteinvariorum@hypothes.is","2019-04-13T14:22:11.217991+00:00","https://ebeshero.github.io/Pittsburgh_Frankenstein/Frankenstein_1831.html","In this 1831 addition, Shelley underlines the moral lesson Victor hopes to impart upon Walton. ","","/p[89]","/p[89]",724,885,
"i9tBOl33Eemjuh9AqA-pGQ","acct:frankensteinvariorum@hypothes.is","2019-04-13T14:22:19.564189+00:00","https://ebeshero.github.io/Pittsburgh_Frankenstein/Frankenstein_1818.html","Victor recognizes that grave robbing and animal torture are ""loathsome activities,"" but imagining the ""great object"" of their results overpowers his conscious. Here, Shelley seems to explore the relation between imagination, morality, and convention, and to what extent feelings express what ought to be done morally.","ethics;morality","/p[128]","/p[128]",120,208,
"iE8fql33Eem_1fODEa3mUA","acct:frankensteinvariorum@hypothes.is","2019-06-04T13:22:30.594285+00:00","https://ebeshero.github.io/Pittsburgh_Frankenstein/Frankenstein_1831.html","This 1831 addition further emphasizes Walton’s bravado, pride, and ethos as an Arctic explorer. The dichotomy of rational man and untamed nature extends throughout the text. The change makes Walton further resemble Victor, who also acts on a “determined heart and resolved will” despite the consequences. 
","","/p[53]","/p[52]",0,123,
"iQevIF33EemPjeMUpUQ_6Q","acct:frankensteinvariorum@hypothes.is","2019-04-13T14:22:14.840082+00:00","https://ebeshero.github.io/Pittsburgh_Frankenstein/Frankenstein_1818.html","St Bernard's Well, a circular Roman-style structure, was built in 1789 to a design by celebrated Edinburgh landscape painter Alexander Nasymth drawing inspiration from the Temple of Vesta at Tivoli in Italy. It is on the Water of Leith in Dean Private Gardens.","","/p[515]","/p[515]",409,427,
"ibtYLF33Eem_qleuQgU2hQ","acct:frankensteinvariorum@hypothes.is","2019-05-04T12:40:32.471115+00:00","https://ebeshero.github.io/Pittsburgh_Frankenstein/Frankenstein_1818.html","The first reference in the novel to Victor's surname.","","/p[140]","/p[140]",525,545,
"im9kFl33Eemf_QcvJzOTXw","acct:frankensteinvariorum@hypothes.is","2019-04-13T14:22:17.208439+00:00","https://ebeshero.github.io/Pittsburgh_Frankenstein/Frankenstein_1818.html","The Creature's awakening to consciousness follows John Locke's account of how the mind slowly learns to distjnguish the various senses before it can apprehend the world. CITE LOCKE SOURCE
","John Locke;empirical epistemology;education","/p[298]","/p[298]",311,416,
"iyJsRl33Eem_1uNcMQgljw","acct:frankensteinvariorum@hypothes.is","2019-04-13T14:22:18.383466+00:00","https://ebeshero.github.io/Pittsburgh_Frankenstein/Frankenstein_1818.html","The magnetic charge of the North Pole, which causes the needle of a compass to point north. Until William Gilbert (1540-1603) discovered the magnetism of the earth's poles, it was a common conception that the needle on the compass moved by force of magic. In Shelley's time, the source of the earth's magnetism was a mystery and many adventurers, such as Shelley's Robert, set out to the North and South Poles seeking answers and concomitant glory. ","","/p[8]","/p[8]",2416,2458,
"j6zIYF33EemVDusuBM6vjA","acct:frankensteinvariorum@hypothes.is","2019-04-13T14:22:25.997241+00:00","https://ebeshero.github.io/Pittsburgh_Frankenstein/Frankenstein_1831.html","Appears as ""laugh"" in the 1818 edition. ","","/p[87]","/p[87]",9,14,
"jKhqSF33EemyUYe-kNAQhA","acct:frankensteinvariorum@hypothes.is","2019-05-04T12:46:02.946338+00:00","https://ebeshero.github.io/Pittsburgh_Frankenstein/Frankenstein_1818.html","Through this letter, the novel suggests a cynical view of lawyers inherited from eighteenth-century writers like Samuel Johnson. CHANGE>In years preceding *Frankenstein*, Percy Shelley dealt unsuccessfully with lawyers in a failed custody battle to win his two children. ","Samuel Johnson;law;Percy Shelley;family;custody;laywers","/p[163]","/p[163]",972,998,
"jQx7MG5rEemmej902Xmrnw","acct:frankensteinvariorum@hypothes.is","2019-05-04T12:53:01.802028+00:00","https://ebeshero.github.io/Pittsburgh_Frankenstein/Frankenstein_1818.html","WE SHOULD ANNOTATE 'SYMPATHY' WHERE IT FIRST APPEARS, DID WE? WE CAN LINK HENRY TO SYMPATHY HERE, BUT DO THE BIGGER EXPLANATION WHEN THE WORD FIRST APPEARS. IT'S CRUCIAL TO THEME OF 'DOMESTIC AFFECTIONS'","","/p[202]","/p[202]",148,158,
"jWpEQl33EemuacMCHxEWug","acct:frankensteinvariorum@hypothes.is","2019-04-13T14:22:22.201004+00:00","https://ebeshero.github.io/Pittsburgh_Frankenstein/Frankenstein_1818.html","Lord Byron and John Polidori. ","","/p[4]","/p[4]",590,608,
"jiOhEl33EemZL2Ppg8dhEA","acct:frankensteinvariorum@hypothes.is","2019-04-13T14:22:23.405348+00:00","https://ebeshero.github.io/Pittsburgh_Frankenstein/Frankenstein_1818.html","The early modern English physician William Harvey (1578-1627) made several valuable contributions to the medical sciences, including the circulation of blood in the human body. In *De Motu Cordis* (1628), Harvey sets down his landmark experiments; in these, Harvey used ligatures to stem blood flow to better understand how the heart works to pump blood throughout the human body. ","Modern Science;Science;medicine;biology","/p[113]","/p[113]",597,612,
"juTiql33EemN3ud3wIr49Q","acct:frankensteinvariorum@hypothes.is","2019-04-13T14:22:24.644609+00:00","https://ebeshero.github.io/Pittsburgh_Frankenstein/Frankenstein_1818.html","The region south of Mayence might be more picturesque because of the Kühkopf-Knoblochsaue, now a well-known nature preserve.","geography;nature","/p[494]","/p[494]",387,400,
"kGLPKl33Eem_17d4zHCL_g","acct:frankensteinvariorum@hypothes.is","2019-04-13T14:22:27.186120+00:00","https://ebeshero.github.io/Pittsburgh_Frankenstein/Frankenstein_1818.html","At this moment the Creature appears more strongly associated with Adam than with Satan, apparently born into a ""paradise.""","John Milton;Paradise Lost;poetry","/p[311]","/p[311]",132,156,
"kR1kXF33Eemju0_SxM2B4g","acct:frankensteinvariorum@hypothes.is","2019-04-13T14:22:28.376576+00:00","https://ebeshero.github.io/Pittsburgh_Frankenstein/Frankenstein_1818.html","Walton, like Victor, the Creature, and perhaps even Shelley herself, all want for friendship. ","","/p[20]","/p[20]",158,194,
"kdK52F33Eemf_geiPpB1jQ","acct:frankensteinvariorum@hypothes.is","2019-04-13T14:22:29.611577+00:00","https://ebeshero.github.io/Pittsburgh_Frankenstein/Frankenstein_1818.html","Heinrich Cornelius Agrippa (1486-1535) was author of *De Occulta Philosophia**, known to practice magic, and considered nonsensical by modern natural philosophy.","science;magic;Cornelius Agrippa;alchemy","/p[86]","/p[86]",470,487,
"koyYEl33EemwQ_fvDEydxA","acct:frankensteinvariorum@hypothes.is","2019-04-13T14:22:30.788769+00:00","https://ebeshero.github.io/Pittsburgh_Frankenstein/Frankenstein_1818.html","Not called ""science"" until the mid-nineteenth century, ""natural philosophy"" was science in the tradition of England's Royal Society, with its emphasis on Baconian induction, careful experiment, and refusal of any older science that could not be proven and demonstrated in a laboratory. ","science;natural philosophy;fate","/p[86]","/p[86]",0,59,
"l8v38F33EemimgP_ccCp_A","acct:frankensteinvariorum@hypothes.is","2019-04-13T14:22:39.623542+00:00","https://ebeshero.github.io/Pittsburgh_Frankenstein/Frankenstein_1818.html","Two of Shakespeare's more fanciful plays, *The Tempest* and *A Midsummer Night's Dream* explore the limits of the human form through its characters: the grotesque monster-human hybrid Caliban in *The Tempest* and the comical Bottom from *Midsummer*, a human with the head of an ass.

Shelley is conscious of *Frankenstein's* play with generic convention and the role genre has in its agreement with representation of reality. In reviewing the first edition in 1818, Sir Walter Scott seems cognizant of the shift in consciousness, he notes: ""The real events of the world have, in our day, too, been of so wondrous and gigantic a kind,--the shiftings of the scenes in our stupendous drama have been so rapid and various, that Shakespeare himself, in his wildest flights, has been completely distanced by the eccentricities of actual existence."" (*Edinburgh Magazine*) (1818) 
","Sir Walter Scott;Percy Shelley;Genre;Shakespeare;The Tempest;A Midsummer Night's Dream","/p[2]/i[3]","/p[2]/i[2]",0,37,
"lB8l3F33EemwRaM6lWVmQg","acct:frankensteinvariorum@hypothes.is","2019-04-13T14:22:33.419331+00:00","https://ebeshero.github.io/Pittsburgh_Frankenstein/Frankenstein_1818.html","Perth is an ancient town on the River Tay in Scotland, about 44 miles north of Edinburgh.","","/p[505]","/p[505]",312,317,
"lN4iDF33EemVDyfFZYTVgg","acct:frankensteinvariorum@hypothes.is","2019-04-13T14:22:34.718195+00:00","https://ebeshero.github.io/Pittsburgh_Frankenstein/Frankenstein_1831.html","In this lengthy addition to the 1831 edition, Shelley gives more color to Victor's life and countenance while in the company of Walton. Victor's grief at Walton's boundless ambition foreshadows and parallels Victor's own thirst for knowledge while at university, related later in Volume 1.","","/p[84]","/p[81]",305,253,
"lZTRvl33EemLBMuYbVdZDQ","acct:frankensteinvariorum@hypothes.is","2019-04-13T14:22:35.901782+00:00","https://ebeshero.github.io/Pittsburgh_Frankenstein/Frankenstein_1818.html","One question that has persisted in the secondary literature is why Clerval found nothing remarkable about Victor's laboratory.","Clerval;laboratory;Victor","/p[174]","/p[174]",636,886,
"lkiJZl33EemVEF8szt-YMA","acct:frankensteinvariorum@hypothes.is","2019-04-13T14:22:37.087729+00:00","https://ebeshero.github.io/Pittsburgh_Frankenstein/Frankenstein_1831.html","Appears as ""feel"" in the 1818 edition.","","/p[109]","/p[109]",2,16,
"lwKGhl33EemW3TcC8d_PlQ","acct:frankensteinvariorum@hypothes.is","2019-04-13T14:22:38.290552+00:00","https://ebeshero.github.io/Pittsburgh_Frankenstein/Frankenstein_1818.html","Retributive justice holds the correct punishment for a crime balances the wrong done, and that punishing wrong doers deters others from committing similar crimes in the future. Note, however, that Justine is wrongfully executed for the death of William. Shelley thus seems to imply that hasty prosecution, especially for the sake of revenge, might hurt the innocent, thereby creating new injustices. 

At the time of its writing, there was already a concerted reformist effort to do away with the death penalty. Fr example, as early as 1762, Jean-Jaques Rousseau wrote in *The Social Contract* that ""There is no man so bad that he cannot be made good for something. No man should be put to death, even as a example, if he can be left to live without danger to society.""","law;justice;Justine;Jean-Jaques Rousseau;death penalty;society","/p[259]","/p[259]",564,605,
"m3HUGl33EemwRssyjEWWJg","acct:frankensteinvariorum@hypothes.is","2019-04-13T14:22:45.733459+00:00","https://ebeshero.github.io/Pittsburgh_Frankenstein/Frankenstein_1818.html","The British name for the Italian port city Livorno, on the Ligurian Sea. Coincidentally, the resting place of Lord Byron and Percy Shelley. The latter died in a storm sailing on his boat, Don Juan, from Leghorn to Lerici, a coastal town on the Gulf of La Spezia.","","/p[368]","/p[368]",90,97,
"mIcORl33EemZMH92H5O-eg","acct:frankensteinvariorum@hypothes.is","2019-04-13T14:22:40.829768+00:00","https://ebeshero.github.io/Pittsburgh_Frankenstein/Frankenstein_1818.html","Tartary was a vast, cold country in the northern parts of Asia, bounded by Siberia on the north and west. A great tract of land in northern and central Asia, it stretched from the Caspian Sea and the Ural Mountains to the west, all the way to the Pacific Ocean in the east. It was inhabited mostly by Mongol peoples.","Tartary;Siberia;Caspian Sea;geography;Mongol","/p[694]","/p[694]",0,111,
"mT0l0l33EemyDMeLoWMLsA","acct:frankensteinvariorum@hypothes.is","2019-04-13T14:22:42.050103+00:00","https://ebeshero.github.io/Pittsburgh_Frankenstein/Frankenstein_1831.html","In the draft, Shelley crosses out Carignan and replaces it with Clerval in two places. In one instance, Clerval is spelled Clairval. Commentators have suggesed an identification with Charles Clairmont, the stepbrother of Mary Shelley. ","Draft","/p[105]","/p[105]",706,719,
"mfeIHl33Eemf_x8W-q29kw","acct:frankensteinvariorum@hypothes.is","2019-04-13T14:22:43.237004+00:00","https://ebeshero.github.io/Pittsburgh_Frankenstein/Frankenstein_1818.html","Archaic term for Muslim, derived from Mahomet, a version of 'Muhummad'.","","/p[362]","/p[362]",454,463,
"mrjBoF33EemqOW_xgmWikQ","acct:frankensteinvariorum@hypothes.is","2019-04-13T14:22:44.529425+00:00","https://ebeshero.github.io/Pittsburgh_Frankenstein/Frankenstein_1818.html","The Creature's story emphasizes the complex question of knowledge--how ""strange"" and contradictory it is to have, how ""sorrow only increased with knowledge""--in ways that suggest it is drastically reductive to see in this novel only a warning against science.","knowledge;empire;inequality","/p[354]","/p[354]",1,38,
"n9Jv4l33EemcrLN5BJbqQA","acct:frankensteinvariorum@hypothes.is","2019-04-13T14:22:53.098296+00:00","https://ebeshero.github.io/Pittsburgh_Frankenstein/Frankenstein_1818.html","Solon (c.  638 – c.  558 BC) was an archaic Athenian poet, statesman, and lawmaker. In Plutarch's telling, he is particularly notable for his efforts to legislate against political, economic, and moral decline in pre-Socratic Athens.","Ancient Greece;Solan;Athens;morality;Plutarch","/p[384]","/p[384]",1340,1345,
"nC5Yul33EemuauNEcdb8nQ","acct:frankensteinvariorum@hypothes.is","2019-04-13T14:22:46.961911+00:00","https://ebeshero.github.io/Pittsburgh_Frankenstein/Frankenstein_1818.html","William Godwin was Mary Godwin's father, the leading radical political philosopher of the Romantic period.  A prolific writer, Godwin was known primarily for his political works, most notably *Enquiry Concerning Political Justice and its Influence on Morals and Happiness* (1793), but also for the novel *Things as They Are; or, The Adventures of Caleb Williams* (1794) and the biography of his late wife Mary Wollstonecraft, *Memoirs of the Author of A Vindication of the Rights of Woman* (1798), an early example of biography.","Godwin;political philosophy;Caleb Williams","/h3[5]","/h3[5]",0,15,
"nOUuWl33Eemim-dvrlwQXw","acct:frankensteinvariorum@hypothes.is","2019-04-13T14:22:48.160921+00:00","https://ebeshero.github.io/Pittsburgh_Frankenstein/Frankenstein_1818.html","Arveiron is a glacial tributary of Mont Blanc. It is referred to twice by Mary in *Six Weeks' Tour*. For example, this entry on July 24: ""Yesterday morning we went the
source of the Arveiron. It is about a league from this village ; the river rolls forth impetuously from an arch of ice, and spreads itself in many streams over a vast space of the valley, ravaged and laid bare by its inundations. The glacier by which its waters are nourished, overhangs this cavern and the plain, and the forests of pine which surround it, with terrible precipices of solid ice."". See Shelley, Mary Wollstonecraft, and Percy Bysshe Shelley. History of a Six Weeks’ Tour Through a Part of France, Switzerland, Germany and Holland: With Letters Descriptive of a Sail Round the Lake of Geneva, and of the Glaciers of Chamouni. T. Hookham, jun. Old Bond Street; and C. and J. Ollier, Welbeck street, 1817, p. 156.
","","/p[283]","/p[283]",128,137,
"naHrJl33Eem_BBdRRra7Fw","acct:frankensteinvariorum@hypothes.is","2019-04-13T14:22:49.404193+00:00","https://ebeshero.github.io/Pittsburgh_Frankenstein/Frankenstein_1818.html","(Percy) Shelley especially singles out Milton among the most important classic literature, indicating his strong influence in the novel","John Milton;poetry","/p[2]","/p[2]",285,291,
"nmYa0l33Eem_q_eWgpc3Vw","acct:frankensteinvariorum@hypothes.is","2019-05-04T13:04:07.555898+00:00","https://ebeshero.github.io/Pittsburgh_Frankenstein/Frankenstein_1818.html","Victor refers to the Creature as his vampire--a reanimated corpse. The vampire was a notorious figure in British lore in the period, which later be immortalized in John Polidori's *The Vampyre* (1819) a friend of the Shelleys and their guest at Villa Diodati in the summer of 1816, when Mary first drafted the novel.","","/p[213]","/p[213]",476,483,
"nxx9pF33EemjvA__P7VWgA","acct:frankensteinvariorum@hypothes.is","2019-04-13T14:22:51.886787+00:00","https://ebeshero.github.io/Pittsburgh_Frankenstein/Frankenstein_1818.html","The lady on horseback is Safie, described as an ""Arabian"" of mixed appearance, and ""wondrously fair."" Safie echos Mary Wollstoncraft's words, and is an exemplar of a woman claiming her rights as a rational being.","Safie;Mary Wollstonecraft","/p[340]","/p[340]",1,27,
"o2SsQl33EemYI09mmpaOow","acct:frankensteinvariorum@hypothes.is","2019-04-13T14:22:59.082674+00:00","https://ebeshero.github.io/Pittsburgh_Frankenstein/Frankenstein_1818.html","It is unclear who this English philosopher might have been, though some have suggested it may have been Erasmus Darwin who published *Zoonomia* in 1794, and whose proto-evolutionary ideas later influenced Charles Darwin.","natural philosophy;Charles Darwin;Erasmus Darwin;science","/p[477]","/p[477]",429,512,
"oIgPAF33Eemg6dc8Ruhmsw","acct:frankensteinvariorum@hypothes.is","2019-04-13T14:22:54.274851+00:00","https://ebeshero.github.io/Pittsburgh_Frankenstein/Frankenstein_1818.html","Theseus was the mythical king and founder-hero of Athens. Plutarch's *Life of Theseus* makes use of varying accounts of the death of the Minotaur, Theseus' escape, and the love of Ariadne for Theseus.","Theseus;Ancient Greece;magic;imagination;monsters","/p[384]","/p[384]",1399,1406,
