id,user,updated,source,text,tags,html_start_node,html_end_node,start_offset,end_offset,reply_to
"LccTdl33Eemilrf6ZPzcJA","acct:frankensteinvariorum@hypothes.is","2019-04-13T14:19:41.754671+00:00","https://ebeshero.github.io/Pittsburgh_Frankenstein/Frankenstein_1818.html","The death of Victor's mother, caused by her catching Elizabeth's scarlet fever, would lead in Victor's mind to a morbid association between the two women. It appears more vividly in Victor's nightmare in  Book 1, Chapter 4, associated there with his first horror at beholding his creature. On the maternal and even incestuous dimensions of this passage, see also ","family","/p[100]","/p[100]",1161,1179,
"LoiUiF33Eemilz8SCfKzfQ","acct:frankensteinvariorum@hypothes.is","2019-04-13T14:19:42.959458+00:00","https://ebeshero.github.io/Pittsburgh_Frankenstein/Frankenstein_1818.html","Victor's decision to tour the English countryside, rather than take the fastest road to Edinburgh, affords his party the chance to compare English geography to Europe's and they do so it considerable detail, beginning with this comparsion of the country around Matlock to Switzerland. Matlock was south of the industrial cities of Manchester and Leeds, but it is on the way to the Lake District in Victor's northern tour.
","geography;england","/p[510]","/p[510]",103,219,
"M0TfuF33EemcqrfnLJyX3A","acct:frankensteinvariorum@hypothes.is","2019-04-13T14:19:50.940210+00:00","https://ebeshero.github.io/Pittsburgh_Frankenstein/Frankenstein_1818.html","The Creature demonstrates that circumstances, rather than innate human sentiments, can inspire virtues such as compassion. Feeling increasingly abandoned—he will say in Volume 2, Chapter 9: ""I am malicious because I am miserable ... If I cannot inspire love, I will cause fear."" But here he expresses sympathy for the cottagers and their abject poverty.","psychology;emotion;sympathy","/p[323]","/p[323]",43,257,
"MDgljF33EemxRENm-nBnPA","acct:frankensteinvariorum@hypothes.is","2019-04-13T14:19:45.756227+00:00","https://ebeshero.github.io/Pittsburgh_Frankenstein/Frankenstein_1818.html","In 1642, Charles I of England gathered forces loyal to him to combat the Parliamentarian Forces led by the Earl of Essex, Thomas Fairfax, and Oliver Cromwell. The conflict culminated in the execution of the monarch for treason in 1649. See: Hughes, Ann. *The Causes of the English Civil War*. 2nd ed, Macmillan ; St. Martin’s Press, 1998.
","","/p[508]","/p[508]",244,255,
"MQJ1MF33EemwQCdKB8j3Lg","acct:frankensteinvariorum@hypothes.is","2019-04-13T14:19:47.157259+00:00","https://ebeshero.github.io/Pittsburgh_Frankenstein/Frankenstein_1818.html","Victor distinguishes Henry Clerval from those, like own his father, who dissociatee commercial life from polite learning. Henry. is a master of languages and especially values poetry, a passion that makes him both equal to Victor's passion for natural philosophy and opposed to it. For more on the exceptional role of Clerval, see XX","Henry Clerval;poetry","/p[103]","/p[103]",471,504,
"Mcr7_l33Eem3tTsi0PFgLQ","acct:frankensteinvariorum@hypothes.is","2019-04-13T14:19:48.493947+00:00","https://ebeshero.github.io/Pittsburgh_Frankenstein/Frankenstein_1831.html","Appears as ""conceive"" in the 1818 edition. ","","/p[90]","/p[90]",15,22,
"MoN6lF33Eem4xRuR1AboAw","acct:frankensteinvariorum@hypothes.is","2019-04-13T14:19:49.679193+00:00","https://ebeshero.github.io/Pittsburgh_Frankenstein/Frankenstein_1818.html","The landscape in southern Holland is mainly flat and strewn with lakes and canals. Since most of the Netherlands is low-lying, with nearly half of the land at or below sea level, it was commonly referred to at the time as ""the plains of Holland.""","geography;Holland","/p[499]","/p[499]",35,52,
"N9tzjl33EemrA4Ow7TFQOQ","acct:frankensteinvariorum@hypothes.is","2019-04-13T14:19:58.673178+00:00","https://ebeshero.github.io/Pittsburgh_Frankenstein/Frankenstein_1831.html","Placeholder (amendment from 1818)","","/p[111]","/p[111]",468,588,
"NBfEHl33Eembc-tOo7XX7A","acct:frankensteinvariorum@hypothes.is","2019-04-13T14:19:52.258325+00:00","https://ebeshero.github.io/Pittsburgh_Frankenstein/Frankenstein_1818.html","It's worth noting that, despite its inability to ""distinguish"" between things,"" the Creature seems not to struggle in identifying the sparrow from the blackbird. ","John Locke;Jean-Jaques Rousseau","/p[303]","/p[303]",461,599,
"NN0dBF33EemxRZvK_S9HWg","acct:frankensteinvariorum@hypothes.is","2019-04-13T14:19:53.625768+00:00","https://ebeshero.github.io/Pittsburgh_Frankenstein/Frankenstein_1818.html","Appearing at the very end of the chapter, Alphonse Frankenstein's words do little to reassure his son (or the reader), of the administration of justice at court. See: Patrick Vincent (2007) ""“This Wretched Mockery of Justice”: Mary Shelley’s Frankenstein and Geneva,"" *European Romantic Review*, 18:5, 645-661.","","/p[233]","/p[233]",47,127,
"NauXBl33Eemf-ZNX_QWGHg","acct:frankensteinvariorum@hypothes.is","2019-04-13T14:19:54.946629+00:00","https://ebeshero.github.io/Pittsburgh_Frankenstein/Frankenstein_1818.html","Victor's tells a teleological story about the path his life has taken.","natural philosophy;Victor","/p[85]","/p[85]",514,744,
"Nm9xlF33Eemvy3OSPe9M3A","acct:frankensteinvariorum@hypothes.is","2019-04-13T14:19:56.275298+00:00","https://ebeshero.github.io/Pittsburgh_Frankenstein/Frankenstein_1818.html","In his book *De Occulta Philosophia* Agrippa suggested that God placed magic in the world capable of transcending the natural sphere to influence the superior realms.","Agrippa;magic;nature;alchemy;science","/p[87]","/p[87]",81,115,
"NycBYF33EemwQYf9URcleQ","acct:frankensteinvariorum@hypothes.is","2019-06-04T13:29:10.401316+00:00","https://ebeshero.github.io/Pittsburgh_Frankenstein/Frankenstein_1831.html","In this 1831 addition, Walton more explicitly attributes exceptional emotional and intellectual powers to Victor than his letters in the 1818 edition make apparent.","","/p[87]","/p[87]",76,864,
"O8y9Il33Eem_pwsXcldClg","acct:frankensteinvariorum@hypothes.is","2019-04-13T14:20:05.281521+00:00","https://ebeshero.github.io/Pittsburgh_Frankenstein/Frankenstein_1818.html","explain","","/p[376]","/p[376]",282,346,
"OJA8al33EemEVSNne1YHSQ","acct:frankensteinvariorum@hypothes.is","2019-04-13T14:19:59.844633+00:00","https://ebeshero.github.io/Pittsburgh_Frankenstein/Frankenstein_1818.html","Goethe published a collection of poetry inspired by the Persian poet Hafiz in 1819; however, the thirteenth century poet Rumi was not translated into English until the end of the nineteenth century. Arabic literature was more common in this period than Persian. *One Thousand and One Nights*, translated by Antoine Galland in the early 1700s, had achieved vast popularity.  ","Goethe;Hafiz;Arabic;One Thousand and One Nights;Persion;Literature","/p[181]","/p[181]",352,378,
"OUlp2F33EemwQn8vi4jNvg","acct:frankensteinvariorum@hypothes.is","2019-04-13T14:20:01.040982+00:00","https://ebeshero.github.io/Pittsburgh_Frankenstein/Frankenstein_1818.html","The former name for the section of the Thames that flows from Gloustershire to Dorchester-on-Thames.","","/p[508]","/p[508]",1064,1068,
"Of9uGF33Eem_zkeqAEmpJw","acct:frankensteinvariorum@hypothes.is","2019-04-13T14:20:02.254206+00:00","https://ebeshero.github.io/Pittsburgh_Frankenstein/Frankenstein_1818.html","Montanvert, also known as Mer de Glace (French for sea of ice) is also referred to by Mary in *Six Weeks Tour*, on July 24: On the other side rises the immense glacier of Montanvert, fifty miles in extent, occupying a chasm among mountains of inconceivable height, and of
forms so pointed and abrupt, that they seem to pierce the sky. From this glacier we saw as we sat on a rock, close to one of the streams of the Arveiron, masses of ice detach themselves from on high, and rush with a loud dull noise into the vale. The violence of their
fall turned them into powder, which flowed over the rocks in imitation of waterfalls, whose ravines they usurped and filled. See See Shelley, Mary Wollstonecraft, and Percy Bysshe Shelley. History of a Six Weeks’ Tour Through a Part of France, Switzerland, Germany and Holland: With Letters Descriptive of a Sail Round the Lake of Geneva, and of the Glaciers of Chamouni. T. Hookham, jun. Old Bond Street; and C. and J. Ollier, Welbeck street, 1817, p. 156-7.","","/p[284]","/p[284]",658,668,
"OvHR7l33Eem1TbfR0Pla2Q","acct:frankensteinvariorum@hypothes.is","2019-04-13T14:20:03.697795+00:00","https://ebeshero.github.io/Pittsburgh_Frankenstein/Frankenstein_1818.html","Victor's understanding of biological systems as machines was typical of nineteenth-century biology and physiology, and the debates between mechanists and vitalists, which still partially embraced the mechanistic perspective of human life advanced by Rene Descartes (1596-1650), and others.","Descartes;science;physiology;Victor","/p[124]","/p[124]",268,402,
"P21IhF33Eem_z3tisLkOqA","acct:frankensteinvariorum@hypothes.is","2019-05-04T10:46:59.206165+00:00","https://ebeshero.github.io/Pittsburgh_Frankenstein/Frankenstein_1818.html","REVISE Shelley's word ""creation"" points toward popular literary themes, and to the Bible. The passage itself also calls into question property rights. For instance, does Victor own *his* creature? John Locke (1632-1704) WHAT TEXT  argued that applying one's labor to nature made that creation one's property. All versions of *Frankenstein* call into question this relation of scientific research to the idea of ownership.","John Locke;property;science;The Bible","/p[124]","/p[124]",1369,1456,
"PG0JZII6EemFsrsXKxEl3A","acct:frankensteinvariorum@hypothes.is","2019-05-29T17:55:22.503355+00:00","https://ebeshero.github.io/Pittsburgh_Frankenstein/Frankenstein_1831.html","Mary Shelley made a number of changes to this passage across editions. In the manuscript, 1818, 1823, and Thomas editions, Victor's father endeavours ""to reason"" to console his son. Yet, in the 1831 edition the appeal to reason has disappeared. In the 1831 edition, Victor's father makes a Romantic injunction, proceeding from a ""serene conscience and guiltless life,"" which he hopes will ""inspire [Victor] with fortitude"" and awaken in him ""the courage to dispel the dark clouds"" brooding over him.","change-ann","/p[291]","/p[291]",111,327,
"PILtml33EemjtUsk1dbtNw","acct:frankensteinvariorum@hypothes.is","2019-04-13T14:20:06.458436+00:00","https://ebeshero.github.io/Pittsburgh_Frankenstein/Frankenstein_1818.html","The next time court was 'in session' in town.","","/p[578]","/p[578]",234,255,
"PUOzGF33EemxRiv8I2UrVw","acct:frankensteinvariorum@hypothes.is","2019-05-04T12:42:56.702504+00:00","https://ebeshero.github.io/Pittsburgh_Frankenstein/Frankenstein_1818.html","This passage comes from Oliver Goldsmith's (1730-1774) novel *The Vicar of Wakefield* (1766), it furthers asks  whether education ought to be directed squarely towards vocational training (as clear from Clerval's father's opinion), or whether learning the classical languages or literature (""the Greeks"") is valuable in itself.","Education;Literature;Goldsmith;Classics","/p[141]","/p[141]",1031,1121,
"Pf880l33EemIkSdLQx0ElQ","acct:frankensteinvariorum@hypothes.is","2019-04-13T14:20:08.965303+00:00","https://ebeshero.github.io/Pittsburgh_Frankenstein/Frankenstein_1818.html","At this moment the Creature appears more strongly associated with Adam than with Satan, apparently born into a ""paradise."" However, Shelley's allusion might be to that of the serpent or snake, as in Revelation: ""So the great dragon was cast out, that serpent of old, called the Devil and Satan, who deceives the whole world; he was cast out to the earth, and his angels were cast out with him . . . He laid hold of the dragon, that serpent of old, who is the Devil and Satan, and bound him for a thousand years (Revelation 12:9; 20:2).","John Milton;Adam;Satan;Revelation;The Bible","/p[312]","/p[312]",132,156,
"PrVWAl33Eem-_m_FCpq83Q","acct:frankensteinvariorum@hypothes.is","2019-04-13T14:20:10.152220+00:00","https://ebeshero.github.io/Pittsburgh_Frankenstein/Frankenstein_1818.html","Victor appears so engrossed in his creation that he forgets his discoveries are predicated on the previous research of scientists and natural philosophers. He fails to acknowledge that he ""stands on the shoulders of giants,"" to use the phrase from Sir Issac Newton (1642-1726), including his teachers, a shortcoming indicative of pride of ownership.","Issac Newton;science;natural philosophy;history","/p[125]","/p[125]",393,429,
"Q-I98l33Eemrr9ehWS993g","acct:frankensteinvariorum@hypothes.is","2019-06-04T13:54:29.941686+00:00","https://ebeshero.github.io/Pittsburgh_Frankenstein/Frankenstein_1831.html","In this 1831 amendment, Elizabeth's nobility appears to be recognizable in her physiognomy. ","","/p[101]","/p[100]",1389,400,
"QCqxYl33EemPiA-YzNUHow","acct:frankensteinvariorum@hypothes.is","2019-04-13T14:20:12.603724+00:00","https://ebeshero.github.io/Pittsburgh_Frankenstein/Frankenstein_1818.html","Celebrated in Italian Renaissance works such as *Orlando Innamorato* and *Orlando Furioso*, Orlando, or sometimes Ronaldo, was a knight-errant with a sword named Durendal and a horse named Veillantif. The 1855 epic poem by Robert Browning, *Childe Roland to the Dark Tower Came* was inspired by his tales of chivalry. 

As a lieutenant of Charlemagne, his great deeds were sung as early as the the eleventh-century in *Chanson de Roland*.  ","poetry;Renaissance;Orlado Furioso;Charlemagne","/p[82]","/p[82]",677,684,
"QNFTvoJaEemqk6Pv32lLQQ","acct:frankensteinvariorum@hypothes.is","2019-06-04T15:13:07.154205+00:00","https://ebeshero.github.io/Pittsburgh_Frankenstein/Frankenstein_1831.html","In the 1831 edition, Shelley elaborates on the surrounds of Victor's journey. In all earlier editions, the party is accompanied by guides throughout their journey. ","change-ann","/p[305]","/p[305]",0,885,
"QOty5F33EemVB_9oO1lgyg","acct:frankensteinvariorum@hypothes.is","2019-04-13T14:20:13.876398+00:00","https://ebeshero.github.io/Pittsburgh_Frankenstein/Frankenstein_1818.html","The first sighting of the Creature in the Arctic, which shortly precedes the appearance of Victor. His ""gigantic stature"" will later be revealed as a height of about eight feet tall. This seemingly minor dimension of the Creature's power can be appreciated when we think about how few giants or outsized human figures appear in modern realism since the mid-18th century.  On this point, see Mark McGurl, GIANTS essay ","creature","/p[39]","/p[39]",566,629,
"QaPsZl33Eemg5t-qu-djjw","acct:frankensteinvariorum@hypothes.is","2019-04-13T14:20:15.061948+00:00","https://ebeshero.github.io/Pittsburgh_Frankenstein/Frankenstein_1818.html","Angelica is the heroine of *Orlando Furioso* by Lodovico Ariosto (1532). ","Orlado Furioso;Agenlica;Lodovico Ariosto","/p[165]","/p[165]",333,373,
"Ql90cl33Eemjtov2Z0DhBw","acct:frankensteinvariorum@hypothes.is","2019-04-13T14:20:16.286200+00:00","https://ebeshero.github.io/Pittsburgh_Frankenstein/Frankenstein_1818.html","Plutarch's *Lives of the Noble Greeks and Romans* is also called *Parallel Lives* or *Plutarch's Lives*. A series of biographies of famous leaders from ancient Greece and Rome, they are arranged in tandem to illuminate their common moral virtues or failings across the two civilizations, and were likely written at the beginning of the second century AD. ","","/p[384]/i[1]","/p[384]",14,16,
"Qx84wF33EemYIG_5O7HWZw","acct:frankensteinvariorum@hypothes.is","2019-04-13T14:20:17.507350+00:00","https://ebeshero.github.io/Pittsburgh_Frankenstein/Frankenstein_1818.html","Robert's high ambition links him to Victor's vast scientific ambition, one of many affinities they will recognize in each other.","ambition;emotion","/p[12]","/p[12]",24,73,
"R3zzTl33EemLAxfN6eSfUw","acct:frankensteinvariorum@hypothes.is","2019-05-04T10:54:52.164104+00:00","https://ebeshero.github.io/Pittsburgh_Frankenstein/Frankenstein_1818.html","Charnel houses were vaults where human skeletal remains were stored. Often they were built near churches for depositing bones unearthed while digging fresh graves.","religion","/p[126]","/p[126]",1252,1266,
"RKKBrF33Eemg52O10-fDYQ","acct:frankensteinvariorum@hypothes.is","2019-04-13T14:20:20.109713+00:00","https://ebeshero.github.io/Pittsburgh_Frankenstein/Frankenstein_1818.html","Victor does not consider the creature's whereabouts or what might have have happened in the interim, despite that more than four months have passed since ""the dreary night in November.""","Victor;time;November","/p[172]","/p[172]",0,26,
"RVYFBl33Eem3tmey1q-Nzg","acct:frankensteinvariorum@hypothes.is","2019-04-13T14:20:21.280337+00:00","https://ebeshero.github.io/Pittsburgh_Frankenstein/Frankenstein_1831.html","Appears as ""engaged"" in the 1818 edition. ","","/p[92]","/p[92]",214,248,
"RgwTKF33EemPidsOb7uJLA","acct:frankensteinvariorum@hypothes.is","2019-04-13T14:20:22.476945+00:00","https://ebeshero.github.io/Pittsburgh_Frankenstein/Frankenstein_1818.html","Historic fortress presiding over the city of Edinburgh, the castle may have been built as early as the 12th Century. ","","/p[515]","/p[515]",303,323,
"RsQWdl33Eem-_5-DaD1QcQ","acct:frankensteinvariorum@hypothes.is","2019-04-13T14:20:23.681472+00:00","https://ebeshero.github.io/Pittsburgh_Frankenstein/Frankenstein_1818.html","By 1818 physiology had become a controversial branch of medicine at the center of the dispute between vitalism, the idea that a divine spark energized animal life, and materialism, the argument that chemical processes alone give rise to life. Mary Shelley was well aware of the dispute since the Shelleys' family doctor, William Lawrence, was vigorously taking up the materialist argument in works like *An Introduction to Comparative Anatomy and Physiology** (1816). For a full view of this controversy as it relates to the novel, see Marilyn Butler, ""*Frankenstein* and Radical Science"" [1993] reprinted in J. Paul Hunter, *Frankenstein,* Norton Critical Edition, second ed. (New York: Norton, 2012) 404-416.","","/p[120]","/p[120]",666,676,
"SCnq-obcEemsuv-YdZr-jw","acct:frankensteinvariorum@hypothes.is","2019-06-04T15:20:27.264020+00:00","https://ebeshero.github.io/Pittsburgh_Frankenstein/Frankenstein_1831.html","As noted above, in this section of the 1831 edition, Shelley elaborates in more detail upon the topography of Victor's journey through the Arveiron, which bears on Victor's mental state.","change-ann","/p[306]","/p[305]",1282,185,
"SDWCVl33Eem1Tj9UtGfYbw","acct:frankensteinvariorum@hypothes.is","2019-04-13T14:20:26.082268+00:00","https://ebeshero.github.io/Pittsburgh_Frankenstein/Frankenstein_1818.html","An archipelago about 10 miles of the north-east coast of Scotland. ","","/p[519]","/p[519]",106,113,
"SO-SQF33EemW2E-0HMq9vw","acct:frankensteinvariorum@hypothes.is","2019-04-13T14:20:27.297100+00:00","https://ebeshero.github.io/Pittsburgh_Frankenstein/Frankenstein_1818.html","The Creature inverts the master-slave relationship, which may explain why apartheid South Africa banned the novel. Throughout the passage, the Creature seems to adopt the voice of Satan's language in *Paradise Lost*.","","/p[535]","/p[535]",253,300,
"Sae04l33Eem_0FuXoJZrsw","acct:frankensteinvariorum@hypothes.is","2019-04-13T14:20:28.526005+00:00","https://ebeshero.github.io/Pittsburgh_Frankenstein/Frankenstein_1818.html","That is, they spoke German, rather than the French of De Lacey and his family.","","/p[424]","/p[424]",275,285,
"Sl4_ZF33EemyTIuCkIzAxw","acct:frankensteinvariorum@hypothes.is","2019-04-13T14:20:29.703824+00:00","https://ebeshero.github.io/Pittsburgh_Frankenstein/Frankenstein_1818.html","Elizabeth was the name of Percy Shelley's mother.","Elizabeth;Percy Shelley","/p[79]","/p[79]",105,121,
"SyDjol33EemyCpNwUT0ohw","acct:frankensteinvariorum@hypothes.is","2019-04-13T14:20:30.960974+00:00","https://ebeshero.github.io/Pittsburgh_Frankenstein/Frankenstein_1818.html","Mainz (French: Mayence) is the capital and largest city of Rhineland-Palatinate, Germany. The city is located on the Rhine river at its confluence with the Main river, opposite Wiesbaden on the border with Hesse.","geography","/p[494]","/p[494]",336,343,
"TAe8jF33EemVCKed1j5BYw","acct:frankensteinvariorum@hypothes.is","2019-04-13T14:20:32.355045+00:00","https://ebeshero.github.io/Pittsburgh_Frankenstein/Frankenstein_1818.html","Percy seems at least a little disingenuous here, suggesting the novel that follows accords to the known ""elementary principles of human nature"". In reality, however, the concept of reality, science, and genre play operating in the novel calls to mind the stratification of ""the Fantastic"" in fiction, set down by French-Bulgarian literary theorist Tzvetan Todorov (1939-2017).","Genre;Fantastic;Percy Shelley;Tzvetan Todorov","/p[2]","/p[2]",139,171,
"TPvp9l33EemDczs_gSNZNg","acct:frankensteinvariorum@hypothes.is","2019-05-04T12:14:36.236300+00:00","https://ebeshero.github.io/Pittsburgh_Frankenstein/Frankenstein_1818.html","Victor's realization that his own pursuit of knowledge has weakened or damaged his ""domestic affections"" begins Shelley's extended argument on this question. But this passage on empire building as the greatest historical antagonist to domestic tranquillity suggests it is the ambition to dominate rather than ""science"" as such that destroys domestic life. WE SHOULD RETHINK THIS WHOLE PASSAGE ON DOMESTIC AFFECTIONS AND HER LINKAGE OF SCIENTIFIC WILL TO POWER AND THE VIOLENCE OF EMPIRE BUILDING IN ROME AND THE AMERICAS. WE'RE ANNOTATING THESE REFERENCES TOO SEPARATELY. I SUGGEST ONE ANNOTATION FOR THIS LAST CRUCIAL SENTENCE. IT'S NOT ABOUT GREEKS ENSLAVING OTHERS, BUT IT'S MAKING A LINK BETWEEN ROMAN EMPIRE BUILDING AND THE SAME PROCESS IN THE AMERICAS NORTH AND SOUTH. THE SHELLEYS (AND BYRON, OTHER ROMANTIC LIBERALS) IDEALIZED THE REPUBLIC AS POLITICAL FORM--A HELLENISTIC IDEAL BETRAYED BY ROMAN AND THEN BRITISH/SPANISH EMPIRE BUILDING. ","family;empire","/p[129]","/p[129]",946,965,
"TU-6CoI7EemOxGu2FS1Q-Q","acct:frankensteinvariorum@hypothes.is","2019-05-29T17:58:02.242476+00:00","https://ebeshero.github.io/Pittsburgh_Frankenstein/Frankenstein_1831.html","This addition to the 1831 further emphasizes Victor's sense of his culpability for the Creature's actions.","change-ann","/p[292]","/p[292]",206,226,
"TcKc4F33EemFyddB0S9h4A","acct:frankensteinvariorum@hypothes.is","2019-04-13T14:20:35.400723+00:00","https://ebeshero.github.io/Pittsburgh_Frankenstein/Frankenstein_1818.html","The religious connotations of the passage connect Victor to the human project of playing God, much as Adam was said to be formed of clay. Historically, Jewish rabbis were also thought to have created golems from clay to seek revenge on enemies. However, following orders literally the golems inevitably became destructive. Cautionary tales about technology and hubris were not only frequent in Shelley's time but have proliferated. In Karel Čapek's *R.U.R* (1920), for example, robots confound expectations by violently rebelling against their creators.","The Bible;Adam;Eve;religion;William Godwin;Karel Čapek;robot","/p[125]","/p[125]",286,349,
"Tz5YFl33EemYIUtTdZNJVQ","acct:frankensteinvariorum@hypothes.is","2019-04-13T14:20:37.876672+00:00","https://ebeshero.github.io/Pittsburgh_Frankenstein/Frankenstein_1818.html","Known for its number and length of bridges, Lucerne had a population of about 100,000 in a 1797 census. Almost exclusively Catholic, it was situated in the the German-speaking region of Switzerland. It remains highly scenic, framed by mountains and lakes. ","Lucerne;geography;Switzerland;Catholic","/p[73]","/p[73]",623,630,
"UAPBll33EemrBAuBWwXxpw","acct:frankensteinvariorum@hypothes.is","2019-05-04T12:51:08.964331+00:00","https://ebeshero.github.io/Pittsburgh_Frankenstein/Frankenstein_1818.html","Plainpalais was a neighborhood in Geneva, which Shelley also refers to in *History of a Six Weeks' Tour Through a Part of France, Switzerland, Germany, and Holland* (1817). In July 1794, Plainpalais was the site where a group of Swiss revolted against the Genovese government with the help of the French revolutionary Robespierre, establishing a tribunal and putting on trial a number of high-ranking Genovese officials. The event is described by Mary:

""To the south of the town [of Geneva] is the promenade of the Genevese, a grassy plain planted with a few trees, and called Plainpalais. Here a small obelisk is erected to the glory of Rousseau, and here (such is the mutability of human life) the magistrates, the successors of those who exiled him from his native country, were shot by the populace during the revolution, which his writings mainly contributed to mature, and which, notwithstanding the temporary bloodshed and injustice with which it was polluted, has produced enduring benefits to mankind, which all the chicanery of statesmen, nor even the great conspiracy of kings, can entirely render vain. From respect to the memory of their predecessors, none of hte present magistrates ever walk in Plainpalais"". (Source text needed). 

Critics suggest Shelley's use of Plainpalais is an attempt to explicitly link the revolutionary events of Plainpalais with the Creature's monstrosity. See Fred V. Randel, ""The Political Geography of Horror in Mary Shelley's *Frankenstein*"" in Harold Bloom (ed.). FULL CITE INFO NEEDED","Switzerland","/p[188]","/p[188]",86,97,
"UMEedl33Eem_0U-oWFlZFw","acct:frankensteinvariorum@hypothes.is","2019-04-13T14:20:40.443617+00:00","https://ebeshero.github.io/Pittsburgh_Frankenstein/Frankenstein_1831.html","Amendment to the 1818 edition.","","/p[89]","/p[89]",563,1312,
